text,value
"Sudah mulai buka, hari biasa masuk hanya lewat pintu timur, sabtu-minggu bisa lewat pintu barat.
Tiket hari biasa 60ribu, sabtu minggu 75ribu, sudah termasuk naik kereta dan kapal.",POSITIF
Kangen sama makan seafood nya.,POSITIF
Sudah beberapa kali kesini. Dari anak pertama sampai anak ketiga. Zoo nya rekomend untuk edukasi anak2. Harga tiket sangat terjangkau. Semoga semakin berkembang lagi kedepannya.,POSITIF
"Arena bermain keluarga yang komplit ,mantap",POSITIF
Masuk bayar 25/orang,NEGATIF
"Wisata alam jogja yang bagus
Ada lanjut wisata nya juga bersama jeep shiva pleateu jogj4x4arta?Ù÷??ÙÔ",POSITIF
Panas....,NEGATIF
"Saya mohon untuk dikelola lebih baik lagi,,
Sedih liatnya.
Terlebih lagi beberapa hewan juga tanpa ada pasangannya. Kasihan lah.
H",NEGATIF
"Terakhir kesini sekitar tahun 2018. Bangunan yang ada masih Tebing Breksinya sama tempat orang jual makanan aja. Sekarang bener-bener udah banyak banget fasilitasnya. Ada penginapan, cafe, tempat camp. Toilet yang disediakan juga banyak. Beberapa bener-bener bersih toiletnya. Luas banget juga areanya, sangat berkembang tempat wisata Tebing Breksi ini.",POSITIF
"kesini pas liburan makan di mbak yanti. jossss enak disini. beli udang di pasar ikan nanti dibawa kesini, makan udang saus padang enak bangetttt",POSITIF
"Baru pertama kali kesini, tempatnya baguss, tp agak susah dijangkau, naik kereta turun stasiun maguwo lanjut taxi online. Kesini juga gara2 promo hehehe..",POSITIF
"Salah satu situs kekayaan budaya Indonesia yang patut dikunjungi ketika di Jogja. Masih terawat dengan baik. Bersih dan nyaman dipandang. Cocok untuk mengisi waktu liburan bersama keluarga dan teman. Jadikan pengalaman liburan berkesan dengan mengabadikan momen dengan kamera anda. Selamat berlibur. Berjalan lumayan jauh dari candi ke arah pintu keluar, anda harus melewati musem, foto2, dan pusat oleh2 khas prambanan. Oleh-oleh berupa baju, tas, cobek, dan aneke kerajinan tangan lengkap disini. Harga murah dan kualitas menyesuaikan.",POSITIF
Pantainya bagus tp ombaknya sangat besar jd gk bisa main air dengan bebas...,POSITIF
"Sangat indah,nyaman dan betah",POSITIF
piknik yang tak ada rencana. ombak gede bener yak,NEGATIF
"Pantai indah, enak tuk bermain... With #Gnetum",POSITIF
"Bagus banget, tapi sayangnya kemarin lagi pandemi ga bisa masuk ke atas lorong"" candi nya.  Cukup di bawah saja. Huhuu sedihh..",POSITIF
"Pantai depok salah satu yang sering keluarga kami kunjungi. Pantai depok terdapat pasar ikan segar yang lumayan membantu pengunjung untuk mencari berbagai macam makhluk laut. Hehehe..... Tpi di pasar ini harus pinter-pinter nawar ya. Di pantai depok jg banyak banget tempat makan yang memberikan layanan masak aneka olahan seafood. Parkir yang luas. Klu dari segi pantai kurang terlalu menarik karena pantainya amis, mungkin karena banyaknya ikan kali. Tempat ini boleh dicoba kunjungi kalu datang ke bantul dan jg jangan lupa makan seafoodnya ya. ðŸ˜",POSITIF
Wajib dikunjungi,POSITIF
"Ombaknya gede, ngga bisa renang deh",NEGATIF
Lumayan indah,POSITIF
"Weekend list buat sendiri ‰Î
Weekend list atas saran bude angkringan depan stasiun lempunyangan ‰ÏÉ

Weekend list dadakan sama keluarga sabtu kemarin ini seru juga,?Ù÷

Baru ini ke tebing breksi perjalanan dari kota Jogja kesana kiraå? 2 jam perjalanan pakai motor, (pegel rasanya) ?Ù?? plus ditambah medan jalannya WOW?Ù÷Ä

Tapi demi ortu yang baru pertama kali ke Jogja ya bisa sesekali?ÙÔ?Ù??Ù÷Ä

Begitu sampai, makin bagus aja si Tebing Breksi ini?Ù´¼

Pembenahannya mulai dari lahan parkir yang makin luas, spot foodcout makin banyak dan kebersihan yang oke punya?ÙÔ?Ù? Toilet dan sarana ibadah(mushola) juga memadai, dan banyak disediakan tempat sampah dimanapun?ÙÔ?Ù?

Spot foto juga makin banyak disini, cuma bayar seikhlasnya udah dapet fotoå? kece alaå? diatas awan plus background kota Jogja di bawahnya, plus kalo beruntung bisa ngeliat candi Prambanan dari atas kejauhan?Ù÷Ä

Subhanallah sekalii‰?",POSITIF
"Obyek utk foto bagus tapi masih belum maksimal penataan lokasinya,,",NEGATIF
Tidak menyenangkan.,NEGATIF
Tarif utk wisatawan lokal cukup mahal..,NEGATIF
Kurang memuaskan,NEGATIF
Keren sekali,POSITIF
Pantai pasir hitam ongkos masuk 10rb per org banyak or jualan ikan goreng udang goreng ikan bakar usang soas menu di rumah makan sambil menikmati deburan ombak pantai depok yogyakarta monggo yg belum pernah mencoba,POSITIF
"Lokasi cukup mudah dijangkau, parkir sangat luas, fasilitas jg lengkap. Tidak terlalu sering ke sini Karena jarak lumayan jauh dari rumah. Ada H&M, Uniqlo, Urbanicon, Adidas, Informa, Ace Hardware, Semar Nusantara, Diamond Pavilion, dan masih byk lg",POSITIF
Pasir hitamnya kl kena air jd mengkilat bagus bgt buat foto2,POSITIF
Jalanya mengerikan....tdk cocok untuk anak kecil...berdebu...ingat lebih baik berhati2 nyawa kita hanya 1...sayangi diri kita sendiri..,NEGATIF
Pusat belanja yang lengkap n luas,POSITIF
tempat yang unik,POSITIF
jogja ga bagus gan,NEGATIF
"Pemburu sunset wajib mencoba di tebing breksi di balkondes nya

Lihat ke barat view sunset terlihat jelas, dan melihat ke barat laut 'sang merapi yang tak pernah ingkar janji' terlihat gagah menjulang",POSITIF
Bagus,POSITIF
KarenAtafihya naik,NEGATIF
Banyak ikan segar pantai relatif bersih,POSITIF
"Setelah hampir 13 tahun tidak ke Parang tritis, duduk aza suruh bayar 20.000 jadi siapkan bila ingin sekedar duduk",NEGATIF
Banyak penjual makanan yang letaknya tdk beraturan.....,NEGATIF
"Tempatnya bagus, banyak hewan2nya. sy suka kesana.",POSITIF
"Bagus bangeeeetttt...
Alhamdulillah puas bnget, tempatnya cocok buat yang suka fotoå??Ù??",POSITIF
Tempat yang cocok untuk wisata kuliner dengan pemandangan laut yg indah,POSITIF
tempat nya bagus,POSITIF
"Keren...ada byk fotographer yang bisa bantu kita bikin foto2 keren ...bayarnya sukarela dan sepantasnya...?Ù÷, byk spot2 foto yang bagus juga.... tiket masuknya cm ceban....?ÙÔ",POSITIF
Sayangnya kondisi pantai kurang terjaga kebersihannya dan minim fasilitas umum..,NEGATIF
"Candi Prambanan bagi saya cocok dijadikan tempat untuk mempelajari hal-hal tentang sejarah, karena di sini kita bisa melihat sejarah sejarah pada masa hindu di pulau jawa, banyak candi candi yang terdapat di sini, bisa dijadikan objek foto yang bagus, jika kita ke sini rasanya tidak akan pernah bosan jika kita ingin berkunjung lagi ke sini, tiket masuknya pun lumayan terjangkau tidak terlalu mahal karena wajar untuk perawatan candinya..",POSITIF
Pedagang asongan di parkiran sangat tidak nyaman,NEGATIF
Tempat berwisata sekaligus kuliner hasil laut,POSITIF
"Selalu suka kalo ke pantai ini , tapi harus pandai2 cari tempat biar gak terjadi kerumunan dan tetap jaga prokes .. Anak suka kalo main di sini , ombak nya woow banget , banyak aneka pedagang makanan , minuman , dll .",POSITIF
Trip pas masa pandemic kemaren Puji Tuhan lancar. Prosedur protokol kesehatan sangat di terapkan sih. Walopun gak bisa naik candi but at least kita bisa visit sampai di pelataran candi. Jadi masih bisa ambil photo candi dalam jarak yang sangat deket.,POSITIF
"Seneng banget Hewan hewannya itu sangat luar biasa dan unik,,,pokoknya senang dan gembira di sana",NEGATIF
Jos... Ditunggu hewan2 yang blm ada ya..,POSITIF
"Candi ini menjadi terkenal dan membuat org penasaran karena cerita rakyatnya. Bangunan yang megah, dan menakjubkan membuat mata yang melihatnya menjadi terkesima. Bagaimana bisa bangunan semegah dan sebesar itu bisa jadi dalam satu malam. Tp itulah kisahnya,",POSITIF
Nggak pernah bosan main ke sini. Menikmati makanan khas laut persis dipinggir pantai,POSITIF
Sebelum msuk kbun binatang Gembira Loka jngan lupa ngopi dlu biar tmbah afdol,NEGATIF
"Ngemall mumpung di Jogja.
Ternyata Sedang ada wedding fair",POSITIF
Terlalu kotor,NEGATIF
Security nya ribed,NEGATIF
"Candi Prambanan atau Candi Roro Jonggrang adalah kompleks candi Hindu terbesar di Indonesia yang dibangun pada abad ke-9 masehi. Candi ini dipersembahkan untuk Trimurti, tiga dewa utama Hindu yaitu Brahma sebagai dewa pencipta, Wisnu sebagai dewa pemelihara, dan Siwa sebagai dewa pemusnah",POSITIF
Cckx Cm ckp dipakai tempat wisata alternatif,NEGATIF
udah pindah cok,NEGATIF
Harga ikan dari nelayan lbh mahal dari pada di kota,NEGATIF
?ÙÔ?ÙÔ?ÙÔ,POSITIF
"Waktu kesini kaget kirain tutup, ternyata pintu timur memang tutup dan dialihkan satu pintu masuk di pintu barat.

Selama pandemi covid beberapa wahana tidak beroperasi. Pengunjung juga dibatasi sebanahk 2.500 orang meski menurut petugas disana seringnya tidak tercapai jumlah segitu jadi aman aja kalau datang mendadak.

Kami berkunjung hari Senin dan tarif masuk sepertinya flat 75 ribu sudah termasuk naik kereta dan kapal.

Asyik dan seru sih meski banyak pembatasan dan gak sebebas waktu sebelum covid.",POSITIF
"masih ada foto dengan satwa, kasihan",NEGATIF
"Selama masa pandemi untuk kedatangan hari senin tdk bs masuk ke dalam candi
Hanya bisa dilingkungannya saja dikarenakan setiap senin ada acara disinfektan",POSITIF
Terlalu panas,NEGATIF
"pantainya jorok, kemfroh, semrawut, sepertinya tidak ada pengelolaan yang terpadu atau memang dibiarkan begitu saja",NEGATIF
Alhamdulillah akhirnya bisa berkunjung ke salah satu peninggalan sejarah yang tak lain adalah candi Prambanan,POSITIF
"Indah di waktu sore menjelang malam....
Mobil harus sehat utk sampai ke tebing breksi.",POSITIF
"Sarat akan sejarah kebudayaan Indonesia, dari dulu sampai sekarang tetap asri, walaupun melelahkan tetapi saat pulang akan tertebus dengan adanya pasar seni dalam perjalanan pulang, tempat ini yang selalu membuat saya antusias ?Ù?Ñ senang melihat kerajinan khas penduduk lokal",POSITIF
Mantap,POSITIF
Bila sore hari lihat matahari tenggelam sangat indah,NEGATIF
"Keren sekali, waktu itu kesini kala diskon cuma bayar 60k 4 orang, gayeng pol, sayang wahananya banyak yang ditutup :(",POSITIF
"Must visit kalau lagi ke Jogja. Di masa pandemi ini, pihak management sangat menjaga protokol kesehatannya.
Fasilitas di dalam candi juga lengkap & bersih seperi toilet, cafe & pusat oleh2.
Pada siang hari sangat panas, jangan lupa menggunakan sunscreen & membawa payung.

Banyak spot foto yang sangat bagus & penjelasan tentang sejarahnya pun cukup jelas. Jika ingin lebih detail, ada guide yang bisa membantu kita menjelaskan.",POSITIF
pokok ny gt2 deah...,POSITIF
"Bagus pantainya. Pasir hitam. Sampah tidak terlalu banyak. Bisa langsung beli ikan segar dari perahunya. Kebersihan bagian pasar perlu ditingkatkan, supaya pengunjung nyaman",POSITIF
"SAYA SEBAGAI WARGA INDONESIA, MALU BANGET KALAU TURIS MANCANEGARA BERKUNJUNG KE PANTAI INI DAN MELIHAT BANYAK SEKALI SAMPAH, AMAT SANGAT KOTOR,",NEGATIF
Skrng pantai dan tempat pemandian kotor..,NEGATIF
"Bagus, rata2 wahananya bersih, paling seru untuk kolam ombak. tersedia loker dengan sewa 30k, tdk bole bawa makan n minum dr luar tp d dlm ad jual makanan n minuman dengan harga minuman mulai 5k dan makanan mulai 22k. Ada wahana utk anak lengkap dengan ember tumbah n mainan, utk dewasa ad kolam dengan kedalaman 80 n 150cm. Harga tiket masuk saat promo 30k",POSITIF
"Seru tempatnya. Untuk wisata di hari libur sangat cocok karena tempat rekreasi yang cukup menyediakan berbagai macam sewa permainan, seperti atv dll. Disini juga menyediakan berbagai restoran aneka seafood yang enak dan murah. Dan juga kita bisa membeli oleh-oleh seafood seperti udang goreng yang perkilonya sangat murah. Untuk tiket masuknya sangat murah. Jadi tempat ini sangat cocok bagi keluarga yang ingin mencari tempat rekreasi pantai.",POSITIF
"Mas mas yang didepan pintu masuk pakai rompi merah sama sekali tidak sopan, saya bertanya apakah harus pakai peduli lindungi soalnya hp saya mati. Lalu saya menunjukan kartu vaksin dan ktp. Tp jawaban nya ketus. Mohon pihak hartono perbaiki service nya",NEGATIF
Makan ikan segar,POSITIF
"Udara yang segar di pagi hari untuk terapi kesehatan,..
Sambil sarapan bubuk,.. Alhamdulillah",POSITIF
Romantis pantai,POSITIF
Situs candi Prambanan sangat menyedihkan krn banyak bangunan candi yang rusak,NEGATIF
Pintu keluar jalannya terlalu jauh..,NEGATIF
ketika ke jogja kemaren. mampir ke pantai depok parang tritis. ada pasar ikan dan bisa minta dimasakin. jd bisa makan seafood fresh,POSITIF
"Kami ke sini,  pas ada acara Muffest.  Muslim festival busana muslim. Ada fashion show.

Hartono mall,  besar,  Bagus.. Bersih.. Luas..
Parkir luas bangets.

Tutup jam 9 malam.",POSITIF
MINIM HARGA MAXSIM,NEGATIF
panas. g ada tempat jualan minum. tidak ramah untuk membawa bayi. karena terlalu panas,NEGATIF
"Disini tempatnya kuliner seafood, ikan masih segar dari nelayan.",POSITIF
"Bagus banget trmpatnya, udaranya juga sejuk, bisa liat pemandangan dari atas",POSITIF
Kalo pantainya sih biasa-biasa saja cuman disini ada TPInya dan bisa langsung dimasak dipinggir pantai ?ÙÐÕ,POSITIF
"Kebun binatang yang sangat luas, menyajikan keanekaragaman satwa dan tanaman yang sangat banyak dan lengkap, ada wahana naiknperahu keliling danau, tempat makan nya banyak, sdh menerapkan protokol kesehatan yang sangat ketat dimasa pandemi ini, jd main berasa nyaman dan aman, tempatnya teduh jd betah berlama2 disana, bila cape berkeliling ada kereta yang bisa kita stop di halte yang sdh disediakan...recomended bgt buat Anak2 belajar mengenal satwa secara langsung",POSITIF
Pasar ikannya... harganya masih terlampau mahal. Tapi alhamdulillah masih bisa ceria bersama keluarga cemaraku,NEGATIF
"Jadi saya ke prambanan sebelum PPKM berlaku, jadi bisa masuk dengan biaya 50 ribu perorang, lumayan juga yaa, disana Panas sskali, mangkanya banyak peminjaman payung dengan harga 10 ribu.. saya membawa kereta bayi, sangat sulit saat mau ke candinya, karena jalur khusus kereta bayi hanya ada di pintu masuknya aja.

Harga souvenir disana sangat murah, dibanding malioboro, kipas bagus banget harganya hanya 5000, kalo dijakarta mungkin 15 ribuan",POSITIF
Salahsatu wisata di Yogyakarta yang wajib dikunjungi,POSITIF
"Merupakan dinding batu yang diukir tempat ini merupakan destinasi wisata baru. Dari tebing bireksi kita bisa melanjutkan mengunjungi situs peninggalan purbakala, candi barong dan candi ijo. Untuk mencapai destinasi wisata tersebut, bisa dengan naik jeep off road atau motor yang tersedia di tempat parkir tebing bireksi. Kalo menggunakan kendaraan off road, tahu sendiri kan jalannya....",NEGATIF
apakah sebegitu susahnya untuk membatu pengunjung yang meminta bantuan.. hingga security saja enggan untuk membatu org yang butuh bantuan...,NEGATIF
"pas ke sini cuma mau makan  siang doang.  beli di pasar ikan di area parkiran, trus dimasakin di warung. ongkos masak 15k per kilo",POSITIF
Tata letak dan lokasi parkirnya terlalu membingungkan :(,NEGATIF
Jangan pake baju merah kalo ke pantai nanti diculik NYI Roro kidul,POSITIF
"Pantai yang menarik, karena kebersihan masih terjaga. Untuk keamanan mending tidak berenang karena gelombangnya agak tinggi. Warna air laut biru sehingga menambah keindahan ketika ingin mengambil foto. Terdapat juga pasar ikan laut dan berbagai jenis olahan makanan laut. Cocok untuk wisata keluarga dan edukasi anak - anak untuk lebih mengenal alam. Pasir bewarna hitam karena pantai ini muara sungai opak yang berhulu di Merapi",POSITIF
"Sangat seru bermain di wahana air jogja bay, banyak sekali pilihan kolam renang dan permainannya.",POSITIF
"Mall yang bener2 luass.. Suka bgt ngeliat2 barang di bagian informa dan sejenisnya.. Trus sukanya dengan mall ini, utk spot anak2 lumayan lengkap dr play zone, butik baju anak, jajanan.. Cocok deh buat ngajakin main anak2. Seruu..",POSITIF
Pantai persis sebelahan dengan pantai parangtritis..ada motor roda tiga yang bisa kita sewa 50 ribu per jamnya..ombaknya juga tinggi angin kenceng pool,POSITIF
Saya mengikuti program Zoopeda. Seru sekali bersepeda di area kebun binatang Gembira Loka. Ada track MTB juga.,POSITIF
Banyak wahana yang tidak berfungsi karena pengurangan karyawan akibat pandemi...,NEGATIF
"Pantai bagus tapi sayang banyak sampah kurang perhatian sekedar saran jika makan sefod disini akan ada banyak ibuk ibuk yang ngomong gini' ayo mas makan ikan murah satu kilo Rp.20.000 pas kalian mau bayar total makan yang kamu makan mulai dari Nasi Lalapan dan minum bisa sampai 50.000 lebih .
Pengalaman saya pesen ikan 1/5 kg kerang 1 kG total makanan yang saya bayar mencapai Rp.90.000 knapa karna Lalapan dan nasi mahal",POSITIF
Tiket masuknya terjangkau. Hewan masih cukup variatif dan menarik. Fasilitasnya juga oke. Cocok untuk wisata edukatif,POSITIF
Tempat jual aneka macam seafood yang fresh,POSITIF
Petugas wahana ngk ramah!!!,NEGATIF
Ikannya segar2,POSITIF
Tempat wisata air yang bagus di jogja,POSITIF
"Mall dekat rumah, dari dulu sejak mau dibangun sampai sekarang semakin ramai meski penambahan outletnya terkesan lambat. Outletnya masih kurang banyak, foodcourtnya lumayan ok meski pilihan makanan tidak terlalu banyak. event mallnya kurang sering. Akan tetapi hartono mall ini lumayan nyaman untuk hangout.",POSITIF
Macet......betul betul tdk teratur....petugas kurang.. sptnya petugas kurang siap .jln diputar putar....tanya petugas katanya tdk ada koordinasi. Lebih teratur di borobudur.,NEGATIF
Saat ppkm bulan April pengunjung sepi menjelang sore,POSITIF
bagus buat sanset,POSITIF
"pelayanan untuk rombongan sangat mengecewakan , terlalu lama harus menunggu print tiket , seharusnya ada cara yang lebih simpel",NEGATIF
"Harga tiket masuk semakin mahal, seharusnya ada diskon untuk wisatawan lokal, kan aset budaya mosok malah di kasih tarif mahal, atau kalau bisa gratis untuk wisatawan lokal, kan orang indonesia mengunjungi tempat sndri, apa kurang pemasukan dari wisatawan asing?Ù÷Ê",NEGATIF
Tempat yang tidak ingin aku kunjungi.,NEGATIF
"Apa bisa tdk d kash bintang, ??
Kamar mandi gelap tdk ada kuncinya, air tdk mengalir warungnya tdk bersih..",NEGATIF
"Masih baru dan dalam taraf pembenahan, terasa sekali udara masih bersih dan menyegarkan",NEGATIF
Elek pollll ra mutu kolam remang larang tenan,NEGATIF
"Lebih sering ke Hartono Mall dalam rangka kerja, pameran Toyota...selama pandemi protokol kesehatan ketat mulai dari pengecekan suhu dll, juga ada petugas yang standby mengawasi pengunjung apabila ada yang membuka masker, diminta & diingatkan untuk selalu memakainya..., sehat selalu buat kita semua ya...",POSITIF
Ya sejak covid jadi agak sepi.. tp masih ramai juga pengunjungnya walaupun banyak wahana yang di tutup to kemarin sempet bisa foto dan memeberi makan gajah,POSITIF
Parkirnya susah. Ruwet,NEGATIF
"Sip tenan
Cuma satu
Kebersihane kurang
Kate guak sampah ora enek adah oranye ne",POSITIF
"Bagus banget, jgn lupa mampir beli Undur2 laut",POSITIF
"Tebing breksi..ga nyangka ya dulu bekas penambangan batu alam..kok disulap jadi kaak gini ya.. serasa semacam mirip2 gwk di bali..
Indah..",POSITIF
"luas, asik, hewannya bermacan macam. siapkan fisik, tp ada krndaraan angkutnya juga",POSITIF
"Tempat main yang tidak pernah membosankan walaupun datang berkali-kali.
Selama pandemi sempat tutup, sekarang sudah mulai buka di hari Sabtu&Minggu. Untuk informasi terupdate bisa cek ig : @glzoojogja
Sebelum masuk checkin/out pedulilindungi jd sementara anak usia <12 th dapat berkunjung saat jam olahraga 06.00-09.00
Jalan-jalan di GLzoo minimal 3jam deh, itu aja belum puas rasanya hahaha

Hewannya cukup lengkap, petunjuk arah jalannya juga mudah diikuti, jadi bisa liat semua hewannya.
Sepuasnya naik Taring & Kapal",POSITIF
Mantap tapi puanas nya,POSITIF
Penjaga diskriminasi kalau lihat pakai jilbab ngak cek ID padahal bisa saja orang Malaysia atau Brunei.,NEGATIF
"Mall besar dan luas dengan banyak toko2 branded didalamnya..uniqlo,hnm,skechers,adidas,matahari,the executive dll...ada wahana permainan untuk anak2 juga,,banyak t4 makan bernama juga..
Toiletnya bersih bikin nyaman
Selama covid buka jam 10.00 pagi sampe jam 20.00
Ada ace h n informa juga..
Swalayan di lantai bawah",POSITIF
Mohon segera di tindak lanjuti perihal pelayanan pelanggan pada mokka caffe yang sangat merugikan konsumen,NEGATIF
"Habis subuh main kesini, kumpul keluarga, kuliner paginya mantab, suasana jg sejuk ombak semilir dengan sunrise... Langit gelap menuju terang...",POSITIF
"Tempat berwisata, mengedukasi anak2 dengan memperlihatkan kutipan alam di depan mereka, sekaligus berolah raga karena jalan sehat",POSITIF
ndak nyaman,NEGATIF
Cuma drop off aja bayar parkir . mohon untuk parkir di free kan di 15menit pertama,NEGATIF
Tiket terlalu mahal..,NEGATIF
ribet... mau masuk nya banyak aturan,NEGATIF
Pantai yang dekat dengan parangtritis. Kalau kesini khusus untuk kulineran menu laut. Banyak pilihan tempat makan yang harga relatif terjangkau.,POSITIF
"Toiletnya jorok, airnya gak kenceng",NEGATIF
"Patut dijaga, dirawat dan di uri2 budaya nya oleh generasi penerus‰Û? ?Ù÷??Ùª?Ù? salam rahayu",POSITIF
Bawa tamu touris. Biaya masuk mahal !,NEGATIF
Very exciting and interesting. Dan ini mesti bawa rombongan banyak karena permainannya begitu menantang dan menjadikan kita untuk saling bekerja sama. HTM on the spot 90rb. Tapi kalau mau dapet murah biasanya hari senin jam 1 siang kebawah. Sooooo..... Ayooo nikmati banyaknya wahana bareng temen2mu ?Ù÷÷,POSITIF
Senang,POSITIF
"bagus luas dan bisa santai, kebetulan dapat promo juga",POSITIF
Pantainya berpasir hitam. Ombak nesar dan angin kencang.  Airnya agak coklat sekilas. Kebersihan perlu ditingkatkan. Banyak warung makan khususnya aneka olahan.seafood dan harga masih masuk akal. Tersedia pula pasar ikan segar dekat pantai. Ada masjid besar yang nyaman.,POSITIF
"Tebing breksi tempatnya indah bisa melihat kota Jogja di puncak tebing, spot foto sangat instagramable sekali, tempatnya rapi dan bersih juga",POSITIF
"Ombaknya Gede, Angin nya  Kwenceng, Pasirnya Hitam, Tapi Sambelnya Pwedes",POSITIF
"Tempat jalan2 kalo pas ke Jogja, Mall gede (tapi tokonya masih blum full seperti Amplas), Mall selain Ambarrukmo Plaza, Jogja City Walk, Malioboro Mall, Galleria, dll. Jumat 29 Oktober 2021 pas ada pameran tanaman hias, fashion, umkm, lumayan rame Mall nya waktu Itu, apalagi Starbucks nya",POSITIF
"Pas ke sana lagi hujan, bersih, tertib, pecel yang jualan mbah2 oke, cafe  yang jual anak2 muda error.",POSITIF
"Keren, asek cocok utk jiwa adventure , pingin balik lg deh kmrn kurang puas kurang lama waktu dsana",POSITIF
Ramai,POSITIF
Tidak asyik Karena satpamnya tidak ramah,NEGATIF
Oke,POSITIF
Kurang bagus,NEGATIF
Nemanin kakak beli berlian di palace. Harga terjangkau dan pelayanan ramah dikasih snack. Makasih yaa mas masnya,POSITIF
"Tempat wisata yang berlokasi di tebing. Fasilitasnya lengkap, Mushola besar dan bersih, tempat makan banyak varian pilihannya, harga tiketnya cuma 10.000, parkir mobil 5.000. Kalian bisa datang pada sore hari untuk bisa melihat matahari terbenam. Pada malam hari juga bisa melihat pemandangan kota Jogja dari atas bukit.",POSITIF
"Bayar 12k per otng sudah bisa masuk dan lihat jogja dari ketinggian, healing bgt kalo kesini sore! Kalau ke jogja jangan lupa mampir ke tebing breksi",POSITIF
View nya ok bgt,POSITIF
"Recomended buat liat sunset, plus banyak pilihan tempat makan yang menyajikan fresh seafood. Juaraaaaa pas lg bosen dikota dan pengen makan seafood harus kesini!",POSITIF
"Pantai nya bersih, kulinernya asyik, menunya emak-emak",POSITIF
Bagus,POSITIF
"seru bgt, harga tiketnya yang promo benerå? terjangkau",POSITIF
"Klo k jogja anak2 pasti ngajak kemari, buat nyamain muka?Ù?£?Ù?£?Ù?£?Ù?£?Ù?£
Sebenarnya krn banyak wahana permainan disini, sebelum si cov-19 menyerang?Ù???Ù÷É",POSITIF
"Salah satu cita2 aku dr kecil adalah main ke  Candi Prambanan hehehe . Alhamdulillah kesampean juga di usia hampir 24 th. Amazing place with amazing soul ‰?•ü tempatnya bersihhhhhh. Toilet bersih. Kalo siang panas bgt jadi kalian harus jaga bawa payung/topi Dr rumah ya gaes. Tapi disana banyak penyewaan payung juga sih.. tiket masuk 50.000 per/dewasa. Jalan keluarnya nnti agak jauh karena muterin pasar dulu .. bisa beli oleh2 disitu juga, Jangan khawatir barang masih bisa di tawarrr... Cocok untuk jalan2 bareng temen2 Dan keluarga",POSITIF
Makanan kmi disita.Saat keluar kami minta kembali makanan kmi hilang...tanpa ada tanggung jwab,NEGATIF
Sayang bnyk batu2 candi yang masih belum di bentuk / batu2 nya berserakan blm tertata.padhl bs buat memajukan pariwisata nya...?Ù÷?,NEGATIF
"Salah satu tempat yang wajib anda kunjungi saat anda liburan ke jogja
Selain tempatnya bagus tempat ini juga penuh sejarah
Dan termasuk salah satu tempat peninggalan kuno yang ada di indonesia
Banyak juga turis yang kesana apalagi pas hari libur
Tiket untuk hari libur cukup mahal untuk kantong anak"" Khos
Saat hari libur tiket masuk 50k per orang
Tempat cukup panas,
Saran dari saya klok memang tidak terlalu suka panas mending nyewa payung di parkiran biasanya ada",POSITIF
"sayangnya tadi  g kebagian pelampung,karena bnyk pengunjung yang menduduki pelampung",POSITIF
"Pantai terlalu sempit, banyak warung",NEGATIF
"Menyenangkan datang ke Prambanan! Tour guidenya sangat informatif memberikan penjelasan tentang sejarah candi Prambanan berdasarkan fakta, bukan mitos. Tersedia kendaraan untuk keliling candi jadi ga capek",POSITIF
Udara malam dingin,NEGATIF
"Suasana nyaman. Parkir tersedia. Kebutuhan pakaian, sandal, perhiasan,  hiburan anak, makanan, dll bisa dicari di sini.
Kalau hanya pengen nongkrong juga bisa kok.",POSITIF
Kotor,NEGATIF
Tempatnya luas banget....jadi susah mencari satwa nya...trus didaerah macan kok kelihatan macam kurang diurus ya para macannya....,NEGATIF
