text,value
Makan siang disini cukup nyaman. Anda bisa belanja ikan langsung ke nelayan yang baru datang jika beruntung atau di pasar ikan. Ikan yang dijual disini tak semua berasal dari tangkapan nelayan tapi didatangkan dari tempat lain. Biasanya dari Semarang. Setelah nya minta tolong dimasakkan di warung buang tersedia sekaligus sebagai tempat makan. Jika suka anda bisa memilih tempat  dengan view pantai.,POSITIF
"Sudah direnovasi, jauh lebih bagus, tiket agak mahal tapi naik kapal dan kereta gratis. ingat!!! Jangan parkir diluar area gembira loka, karena bakal di cas 5x dari parkir resmi yang hanya 5000 per mobil. Sebaiknya parkir di dalam bonbin atau parkiran sisi barat",POSITIF
Cool..cukup indah..tolong jaga kebersihan aja..masih ada sampah- sampah berserakan.,POSITIF
"Lokasi bagus, datang pagi2 sebelum jam 8 no karcis...",POSITIF
Mantab dan cukup bersih pantainya dan indah,NEGATIF
Masihh ga bagusss jodoh belum keliatan di situu?Ù÷Ç?Ù÷Ç,NEGATIF
Batita bayar penuh.,NEGATIF
Capek antri parkiran,NEGATIF
Tempat nya bagus nyaman untuk kelurga,POSITIF
"akses jalan ke lokasi lancar, semua tarif masuk parkir dll sudah dipasang sehingga sangat transparan dan profesional",POSITIF
"Mantap, kaki mau copot. Tapi untung ada kendaraan didalam",POSITIF
"Bagus bgt untuk wisata sambil belajar, mengenalkan anak dengan sejarah budaya indonesia abad ke 9, tiket masuk nya 50rb untuk dewasa dan anak2 25rb atau kalian bs jg beli tiket terusan ke borobudur atau candi ratu boko, kalo tiket terusan 75rb/dewasa anak2/35rb.",POSITIF
Parkir mahal,NEGATIF
Beli ikan disini langsung dimasak di rumah makan di pinggir pantai...,POSITIF
Bagus good and relevan,POSITIF
"Birokrasi untuk mengexplore masih birokrasi jaman batu, selektif namun ngga Adil.",NEGATIF
Pantai yang indah dan menjaga kebersihan karena setiap sudut diberi tempat sampah... Penjual nya ramah ramah... Paling suka kesini terus mampir beli pecelnya bu giyanti .. ramahh banget dan pastinya endesss,POSITIF
"Ada didalamnya ada tempat makan gili gili, pelayanannya lamanya minta ampun",NEGATIF
"liburan keluarga pertama d'tahun 2020..
tujuan kami yaitu mantai & nge-seafood d'Pantai Depok..",POSITIF
"B aja, gak sesuai sama harga",NEGATIF
Whaaa...ini salah 1 destinasi wisata yg wajib dikunjungi apalagi buat makan siang dengan aneka ikan laut segar yg bisa di beli di tempat ini.,POSITIF
"Baru pertama kali ke Breksi pengin foto2.. Eayalaahhh.. Hujan dr siang ampe maghrib.
Cuma numpang sholat doang pulang lg... Hiks?Ù÷´",NEGATIF
"Pantai Depok letaknya tidak jauh dari Pantai Parangtritis. Kalau Sabtu Minggu pagi ada Pasar Tiban ternyata, sayang tadi kami pagi ke Pantai Parangtritis dahulu baru ke Depok, jadi tidak bisa ikutan pasar tiban.
Karena ke Pantai Parangtritis dahulu jadi kami melewati TPR, bayar tiketnya 10rb /orang, balita tidak dihitung. Untuk parkirnya di Pantai Depok 7rb, sedangkan di Pantai Parangtritis 15rb (lumayan mahal yak)

Kalau di Pantai Depok kita lebih fokusnya untuk membeli ikan. Kalau dulu, sekitar 5th yang lalu, kami bisa beli langsung di kapal2 nelayan (itu pada siang hari).... Tapi tadi ternyata sudah tidak ada, jadi untuk membeli ikan bisa di TPI (Tempat Pelelangan Ikan). Kita bisa beli ikan disana dan dimasak dengan harga 15rb (biaya masaknya yaaaa)

Disini penjualnya lebih banyak daripada di Pantai Parangtritis, dan rumah makannya pun rata2 menyajikan makanan sea food. Untuk anak2, disini juga disediakan kolam renang,  dengan tiket 10rb /orang",POSITIF
Daftar harga tidak sesuai dengan kualitas,NEGATIF
"Kalau biasanya ke Jogja untuk berburu tempat wisata, hari itu jalan jalan ke Mall. Menikmati beberapa tempat, sebelum kw CGV untuk melihat jadwal fillm. Mall yang berada di pusat kota ini termasuk High Class menurutku. Bersih; sisi panggung yang menarik, mungkin sudah atau akan ada acara. Terima kasih.",POSITIF
"Sangat menyenangkan ke candi prambanan,Kangen kesini lagi dan semoga lain kali selanjutnya ksni bs bareng keluarga .",POSITIF
Tombol LM pada lift tolong diperbaikiðŸ™ðŸ˜…,NEGATIF
Keren bgt candi nyaaaa.. bagus2 spot fotonyaa,POSITIF
"Terlalu biasa pemandangan candi, tiketnya mahal, perlu inovasi untuk daya tarik pengunjung....",NEGATIF
Tempat wisata yg bagus,POSITIF
Bagus nyantai pantai nelayan bisa beli ikan langsung dari nelayan,POSITIF
Asil looo,NEGATIF
"Satu-satunya kebun binatang yanga ada di Yogyakarta, walau harga tiket masuknya mahal tapi sudah semua fasilitas didalam dinikmati, seperti kereta buat keliling, kapal yang bisa dinaikin kapan saja dan berapa kali terserah kita. Setiap tempat dinamainnya lucu-lucu, ada zona cakar, zona aves, zona reptil, zona aquarium. Didalamnya macam-macam, binatangnya juga lumayan lengkap, yang membuat bagus lagi dari tempat ini adalah tata ruangnya yang keren abis, dan asiknya lagi setiap jam 2 siang itu ada jadwal pertunjukan dari hewan. Seru deh kalo kesini gak habis cerita",POSITIF
"tempat makan makanan laut enak dan harga ramah dengan dompet, dengan suasana pantai yang dapat dijadikan bermain anak dan foto-foto bersama, mobil pun dapat diparkir dengan teduhan dari sinar matahari. Pantai dengan pasir hitam",NEGATIF
Pantai kotor. Kurang tertata rapih,NEGATIF
Bayar gi gate depan murah tapii begitu masuk tiap pindah tempat bayar parkir terus hitunganya malah jd mahal,NEGATIF
"Destinasi wisata alam di Yogyakarta termasuk yang paling diminati wisatawan. Lokasinya mudah dijangkau, dipinggir jalan satu arah menuju candi Ijo.

Tempat ini merupakan bekas tambang batu yang sudah tidak di eksplorasi lagi, mungkin karena pertimbangan kebijakan pemda setempat, hingga akhirnya dialih fungsikan sebagai tempat wisata.

Sarana dan prasarana yang ada cukup memadai, banyak spot photo, viewnya menarik, ditempat ini dulu sebelum pandemi sering digelar pertunjukan seni luar ruang.",POSITIF
Kurang terawat,NEGATIF
"Meskipun koleksi hewan untuk dikenalkan ke anak banyak yang tidak ada (contohnya zebra, jerapah, beruang, koala, kanguru, rusa, panda).. secara pelayanan bagus, dan bikin anak seneng karena bisa naik kereta kelinci muter2 gembira loka berapa kalipun tanpa harus bayar lagi..",POSITIF
"Bagus,indah melihat pemandangan dari puncak tebing,parkir luas,bersih,dan banyak spot-spot foto yang indah. Pokoknya OK banget. Harus buktikan sendiri.",POSITIF
"Pantai Depok merupakan salah satu objek wisata yang ada di kawasan pantai selatan Yogyakarta
Tepatnya di daerah kecamatan kretek Bantul
Di pantai ini anda bisa menikmati keindahan pemandangan pantai selain itu anda juga dapat membeli ikan hasil tangkapan nelayan yang masih fresh tentunya
Di pantai ini juga ada warung yang siap menjual  ataupun mengolah ikan yang anda beli",POSITIF
"Bagi saya yang bukan orang kaya Kok mahal sekali tiket masuknya sampe 50k. Padahal saya orang indonesia pingin banget melihat seperti apa peninggalan leluhur, saya bangga saya senang, tapi saya kecewa juga, pas udah masuk ngga boleh lihat2 ornamen di dalamnya..",NEGATIF
"Pas promo jd murah bgt tiketnya... seru kolam ombaknya, pokoknya asyik bgt kpn2 pasti ksini lagi‰?•ü?Ù÷",POSITIF
"Cocok untuk jalan-jalan bareng keluarga
TOP",POSITIF
"Keren, Karunia Tuhan.",POSITIF
"lusa kemarin kesini dan ke pasar ikannya, saya dapat dan bisa membeli dengan harga yang tergolong murah di tempat tinggal saya/ kota, saya rekomendasi di sisni, tapi harga dapat berubah ubah ya",POSITIF
"Takjub sama kota yang 1 ini...
JOGJAKARTA, langit biru, awan putih lembut kaya kapas, hawa sejuk, orang ramah, makanan enak, tempat wisata bersih, penataan rapih, nggak ada macet macetan kecuali kawasan Malioboro..
Semoga Covid-19 segera berlalu.. Bismillah, mau kesana lagi.
Pengalaman tinggal disana 1 minggu ternyata kurang puas... Harus dan wajib banget kayanya buat Stay cation disana 3 bulanan biar semua tempat bisa di cobain...

Pokoknya Jogjakarta Indah bangettttt, dan aku sukak...

Note : sehabis touring ke Jogja, sempat kecelakaan di daerah Subang jam 1malam di kawasan hutan tebing gitu, tangan suami patah.. Alhamdulillah di tolong warga kampung situ... Panjang umur orang2 baik.",POSITIF
"Bgus,  pemandangan indah?Ù÷?Ù÷?Ù÷",POSITIF
Ok buat makan seafood,POSITIF
Perlu dijaga kebersihan dan tata letak pedagang,NEGATIF
Pantai yang indah nyantai berendam view juga bagus,POSITIF
Aula sekolah,POSITIF
Pantai bantul dengan destinasi makan seafood. Ada pasar ikannya juga jadi bisa beli ikan segar. Bisa foto dengan berbagai macam properti.,POSITIF
"Pantai yang eksotis, pantai paling terkenal di pulau jawa. Apa ya. Kesan mistisnya yang kentel sih.",POSITIF
Fasilitas memadai.,POSITIF
"Kotor tak dirawat pantainya, beda dengan pantai parangtritis
padahal deket juga satu wilayah",NEGATIF
"Mall yang cukup lengkap, sering banyak diskonan, banyak pilihan merk"" branded.parkir mudah,betah keliling disini bs lupa waktu.tapi akses kesini cukup padat kudu sabar sekali..hehe",POSITIF
"Pernah kesini... Piknik ,,, suka dengan hawa nya sejuk , berangin , pasir nya halusss...
.
Sebelum subuh Sdh di area sini sampai menuju siang..",POSITIF
"Nyesel udah kesana, percuma udah bayar mahal tapi semua fasilitas belum bisa kepakai, pelayanan yang sangat buruk ditambah suasana yang buruk ... Untuk sewa loker antrinya sangat panjang. Masih bagusan pandawa di solo sama water blaster di semarang, pokoknya aku nyesel sudah ngeluarin uang untuk pergi ke tempat buruk seperti Jogja Bay, tolong diperbaiki lagi, jangan mengecewakan masyarakat ...",NEGATIF
"Salah satu waktu terbaik saat mengunjungi Candi Prambanan menurutku adalah sore hari, selepas shalat ashar. Mengapa? Cukup dua foto ini menjelaskan bagaimana suasana di Candi Prambanan ketika matahari hendak tenggelam. Yang pasti matahari tak lagi menyengat dan juga sinarnya sangat bersahabat.

Waktu 2 jam cukuplah untuk berkeliling ke seluruh area dan juga menikmati setiap relief yang ada di candi ini. Relief ini menceritakan kisah Ramayana dan Krishnayana. Ada triknya lho saat berkeliling candi agar relief bisa terbaca dengan urut. Kamu bisa mengitari candi utama searah jarum jam. ?Ù÷

Jika sempat, lanjutkanlah perjalananmu naik kereta mini hingga singgah sejenak di Candi Sewu.",POSITIF
"Waspada makan di sini, banyak pengunjung dikenakan harga selangit oleh para pedagang.",NEGATIF
"Mantul lah, pas dpt disc pula ?Ùªö",POSITIF
"Bagus, bersih, panas, rindang pokoknya komplit.
Staff ramah dan komunikatif.
Hanya saja alangkah lebih baik kalau pedagang cinderamata juga mengindahkan prokes, paling tidak masker dikenakan. Justru ibu2 yang menyewakan payung di area parkir lebih taat prokes.",POSITIF
Pantai bersih,POSITIF
"Pantai ini sama indah nya dengan parangtritis,  akses jalan mulus dan lancar, parkir luas, ada pusat kuliner dan area belanja oleh2. Yang spesial di pantai ini, kita bisa beli ikan segar hasil tangkapan baru para nelayan yang baru pulang melaut,  langsung dilelang.",POSITIF
Keren t4 e puas buat teriak2,POSITIF
mantap,NEGATIF
"Kesini pas mendung,.jd ga kliatan sunsetnya hehe",POSITIF
"Pertama kali kesini awalnya bingung diarahin ke pasar, ternyata milih ikan segar buat dimasak ðŸ¤¤",POSITIF
"Not so good, pantainya ga bisa dipake buat berenang. Ada tempat makan, tp harus pintar"" milih tempat. Pedagangnya suka pilih kasih sm yang bawa motor, padahal dateng duluan tp dikasi makanannya terakhir.",NEGATIF
Kesini pas sepi heheheheh,POSITIF
Lebih asik pagi atau soree. Menikmati masakan laut sambil nonton ombak wkwk asiik,POSITIF
"bersih,fresh.. cuma syang pas k sna hari senin.. jdi tidak bisa masuk k area candi.. hanya dipinggir2 aj.Senin jdwl pemeliharan candi...",POSITIF
"Tempat yang sayang untuk di lewatkan, candi prambanan, wajib mampir yaa klo ke jogja, bangunan bersejarah yang menajubkan yang klo liat jangan di pikir gmana bikinnya, yang pting...kesini dulu..",POSITIF
"Mahal bagi sebuah kebun bintang ntah tau apa yang tersedia di dalam nya
Nb: boleh di komen kalo tau apa saja di dalam dan tambah biaya atau tidak untuk di dalam nya",NEGATIF
"Tempat wisata pantai yang lumayan bagus, sayang agak kotor, bisa beli ikan dengan harga murah kalo pake bahasa jawa. Sayangnya ditawarkan lebih mahal kalo tidak pakai bahasa jawa, bisa dimasak langsung di warung sekitar dengan harga yang relatif murah.",POSITIF
"Minggu pagi disini..  Sdh bisa sarapan,  bubur sayur,  gorengan anget pokomen jos",POSITIF
"Semua pasti tahu mall ini ya, kalau jeli bisa dapat barang bagus dan nggak mahal. Ada Ace hardware, Matahari, outlet2 dari brand busana yang populer, optik2 dll.",POSITIF
"Tempat nya luas, fasilitas lengkap, mushola, home stay, parkir luas, warung banyak juga. Pemandangan bagus kalau malam juga.",POSITIF
"Makan seafood murah, masakan enak.",POSITIF
Pantai depok yang indah d bantul jogjakarta,POSITIF
"Saya dan 4 teman saya kehilangan helm di parkiran resmi mall dan jawaban pihak parkir dan scurity semua jawaban nya sama TIDAK TERPANTAU CCTV
Dan sampai sekarang tidak ada sama sekali permintaan maaf atau pertanggung jawaban atas kehilangan saya
Sangat mengecewakan",NEGATIF
Sekarang tiket sudah termasuk naik kereta Dan naik kapal. Tempat keluarga yang seru. Semoga semakin komplit koleksi satwanya,POSITIF
Pokoke asyik banget.  Pha lagi sampai sana dah sore... Poko'e adhem..,POSITIF
"Deretan pantai  di pantai selatan.. Ada obyek wisata lain..spt gumuk pasir, pantai parang kusumo, pantai parang tritis, dan parang wedang klo g salah..
Main ke pantai..  Beli ikan..  Trus dimasake skalian..trus main ke pantai sebentar.. Trus makan... Yummy",POSITIF
Salah satu destinasi yang wajib buat dikunjungin. Apalagi buat liburan rombongan,POSITIF
Pertama kali sampe gembira loka sempat terkejut dengan ongkos parkir 25ribu (parkir luar).. kok lebih mahal dari mall yang pakai tarif  per jam.. bg pengunjung kalau bisa lebih baik parkir di dalam..,NEGATIF
Buat saia sih seru...setelah sekian purnama ppkm...meski keliatanya binatang2nya agak gak terurus dan kurusan...mgkn krn efek ppkm tdi yaa....semoga setelah keadaan membaik...gembira loka juga tambah rame yaa....tapi saia gak kuat jalan luas banget...untung bisa naek kereta sepuasnya...naek kapal juga udh masuk ketiket...asyikkk pokoknya...cobain deh..,POSITIF
"Akses mudah dari kota yogyakarta, garis pantai luas, banyak rumah makan yang menyediakan olahan laut ?ÙÔ",POSITIF
foto sebelum pandemi  ?Ù÷É,POSITIF
"Fasilitas toilet untuk pria di tutup semua dan di sisain 1, sangat tidak nyaman sekali.",NEGATIF
Salah satu pantai yang direkomendasikan untuk pecinta kuliner seafood.,POSITIF
Peraturan ga jelas....,NEGATIF
bisa beli ikan segar dari nelayan,POSITIF
"Sebuah tempat Wisata buatan, yang nyaman berada di dataran tinggi dengan Pemandangan gunung merapi serta nuansa kota Jogja terlihat dari Kejauhan, untuk mendatangi lokasi ini memang tidak sulit akan tetapi kendaraan anda harus fit karena tanjakan lumayan curam. Dibutuhkan kehati hatian anda Gunakan Gigi 1 biar aman apa bila akan naik Ke lokasi. Tempat Parkir luas, serta Ada tempat kulinernya. Tidak mengecewakan.",POSITIF
"Indah sekali luarbiasa pokoknya, harga tiket terjangkau",POSITIF
"View dan ombak pantai sangat menawan dekat dengan daratan.
Kuliner enak dan harga terjangkau",POSITIF
Ombaknya terlalu tinggi dan berbahaya buat berenang.  Pantai pasir hitam.  Sayang kebersihannya gak dijaga.  Lokasi wisata yang harus di manage dengan lebih baik,NEGATIF
"Sangat luas indah banyak hewan,ada ikan ,arwana badak buaya harimau jerapah dll",NEGATIF
"Pantai nya bagus, makanan enak dan terjangkau",POSITIF
Bekas tambang di kelola dengan baik bisa memberdayakan masyarakat sekitar lokasi,NEGATIF
"Kalo mau keluar di paksa untuk jalan 2 kilometer dulu.. harus lihat dagangan sejauh 2 KM sebelum pulang.. wajib.. mau orang tua.. ibu hamil.. ndak peduli.. situs budaya nya bagus.. tapi manajemen nya sangat buruk

Jadi kalo sudah cape dan mau pulang..
Siap siap disuruh jalan panas panas atau kehujanan sejauh 2 kilometer lebih..

Siapkan tenaga tambahan.. ndak peduli siapa anda..
Penjaga pintu masuk kasar*",NEGATIF
lokasi bagus... cuma gk suka jha tai kuda yang ada dtepi pantai... ?Ù÷?,NEGATIF
"Pantai pasir hitam, banyak pengunjung di musim liburan. Banyak sampah juga. Gak beda jauh sama parangtritis.",NEGATIF
Foto sama boneka jerami harus bayar. Parah,NEGATIF
Tiket mahal,NEGATIF
"Dari kecil sampe sekarang ga pernah bosen kalau ke Prambanan, tempat bersejarah selalu bisa ngasih banyak pelajaran. Biaya masuk 50 ribu, bisa muter-muter sepuasnya. Protokol kesehatan di masa pandemi sudah bagus. Kalo cuma nyari tempat foto, disini sangat banyak spot yang bisa dipakai.",POSITIF
"Tempat wisata yang sempurna, tebing yang terbuat dari alam, membuat kita takjub melihatnya",POSITIF
"Tempat dan binatang2 terlihat terawat.. bulan Puasa dan pandemi hanya Sabtu Minggu saja bukanya. Mungkin karena datang hari Sabtu ( sudah 5 hari binatangnya berasa bebas tanpa kunjungan) bbrp binatang lebih ekspresif. Cukup banyak tempat untuk istirahat sejenak, transportasi keliling sangat membantu. Wisata kapal mungkin perlu dibuat lebih menarik, bangunan tua bs digunakan jadi museum atau info lain, seperti siklus kehidupan binatang atau lainnya. Menu makanan minuman bisa ditambah. Feeding animal lebih baik tidak dipaket dengan foto dan souvenir.",POSITIF
Tiket mahal.area luas tapi binatang nya membosankan.tidak menarik,NEGATIF
Gembira bersama Anak adh adhsa,NEGATIF
Dari kecil sampai skrg sudah punya anak kecil gak bosen2 berkunjung ke sini‰Û? topppp ?ÙÔ?ÙÔ?ÙÔ,POSITIF
"Cocok banget untuk pemandangan sunset dan bnyak restoran makanan segar...
Kekurangannya hanya pada kebersihannya",POSITIF
"Pantai tempat makan dan belanja berbagai ikan dan hasil laut
Berbagai jenis ikan dan kerang kerang banyak tersedia di sini mau dimakan di sini atau di bawa pulang ..
Ada pasar ikan di sini yang sangat fresh from the ocean ?Ù÷Ä?Ù÷Ä  untuk tempat parkir luas tersedia juga kolam renang di sini masjid toilet tersedia di sini satu area jadi tidak perlu pergi jauh.
Jadi selamat berkunjung,,",POSITIF
Tempat hiburan untuk mengenalkan anak-anak tentang hewan,POSITIF
"Favorite kesini, beli ikan di pasarnya terus dimasakin di warung2 makannya. Pantainya ga terlalu bagus yang penting makan seafoodnya",POSITIF
"Kurang terawat, mungkin masih sebatas TPI tp menurut saya lho....",NEGATIF
Tebing yang indah biar malem kita sampai tp indah bisa lihat kota Jogja dari atas tebing......?ÙÔ?ÙÔ?Ù÷÷,POSITIF
"Pantai nya bersih , ramai pengunjung laut nya berombak kuat ?Ù÷â sempat takut karena baru pertama kalinya kesini dan melihat ombak seperti itu , nuansa alam nya terasa sekali udara disini juga sejuk",POSITIF
"Tempat rekreasi yang bisa jadi salah satu pilihan rekreasi keluarga. Tiket masuknya jadi lebih mahal ya sekarang, saya ke gembiraloka tanggal 12 April dan tiket masuk per orang 65ribu, udah termasuk naik ""shuttle"" di tiap halte dan keliling danau pake perahu, belum ternasuk biaya naik speed boat. Musholla cukup luas, sayang waktu ke gembiraloka gak lihat macan dan singa. Ada black swan juga yang cantik dan untuk dunia reptil cukup lengkap.",POSITIF
"Not worth every penny.
Sedih ngeliat hewan-hewan yang ada di sana. Rata-rata hewan di sana per kandang cuma 1 ekor. Kasian banget. Udah gitu hewan-hewannya cuma diem aja, jadi tambah menyedihkan.

Juga masih banyak animal abuse (mis: naik gajah, naik onta, terus juga ada kolam ikan kecil-kecil di mana orang terutama anak-anak bisa asal nangkep/mancing tuh ikan). Parah banget.

Kandang hewan juga terlalu sempit. Di dalem sana saya cuma bisa ngelus dada, ya ampun.. Dengan pengunjung sebanyak itu (per org 40 ribuan), masa kebun binatang sebesar ini nggak merhatiin kesehatan dan kebahagiaan hewan-hewannya?

Soal pengunjungnya (kalo yang ini setengahnya bukan salah pihak zoonya), banyak yang nggak tertib. Banyak yang ngerokok di area dilarang merokok. Terus di tengah jalan masih banyak yang asal duduk lesehan. Bener-bener ga ada etika.",NEGATIF
"Beautiful dikala senja, sumpeh‰ÏÎ?ÙÈ",POSITIF
"foodcourtnya luas, nonton bisa, belanja bisa banyak branded store, cemilannya banyak jugaa. mushola ada di LG atau di dalam mall nya, lebih baik bawa mukena sendiri ya",POSITIF
Cuma pahatan kita yang gak suka foto jangan kesini,NEGATIF
Pantainya asik.. ada perahu nelayan disini... Banyak warung makan juga,POSITIF
"Tempatnya bagus dengan ombak yang cukup tinggi, sudah tersedia masjid juga dan parkir yang luas",POSITIF
Apa yang mau dibagi...ndak ada,NEGATIF
Pertama kali berkunjung ke tempat ini dan cukup membuat pusing mencari akses masuk dan akses keluar (maklum tidak membawa kendaraan pribadi). Di dalamnya begitu banyak tenant-tenant yang super lengkap.,POSITIF
Tempat oke tp kl masuk mataharinya hati2 krn bnyk copet. Pengalaman pernah kecopetan di dlm mataharinya,POSITIF
Banyak tempat bermain air seru,NEGATIF
Tempat rekreasi pantai selatan Jogja ttg biasa banyak rekomendasi untuk berkuliner sea food .,POSITIF
"Tiket mahaaall.. wahana kurang menarik..
Sekali saja sudah cukup. Sekedar pengen tahu isinya. Sama seperti waterboom",NEGATIF
Wisata keluarga yang nyaman,POSITIF
Tempatnya bagus . Bisa makan di pinggir pantai karena setiap Minggu banyak yang menjajakan aneka makanan,POSITIF
"Kalo lagi pengen iwak laut yaa kesini, pagiå? nunggu nelayan pulang sambil mainå? air dan menikmati semilir angin yang menyentuh setiap senti kulit kita hehe",POSITIF
Pantai nya kurang terawat.......,NEGATIF
"Waktu aku ke sini ombaknya lagi lumayan tinggi jadi nggak main sampe ke bibir pantainya. Disini juga ada pelelangan ikan, dimana ikan yang baru dipancing bisa langsung dibeli dan diolah untuk dimasak, untuk dioleh seperti apa bisa dipilih. Tapi harus hati-hati, kalau salah pilih restoran bisa-bisa kecewa kek saya hiks hiks

Oh iya untuk masuk ke sini harus bayar 20.000 per kendaraan motor (bonceng 2).",POSITIF
Hewan pada d tutup,NEGATIF
Bagus... Bersih. Asik aja kesini.,POSITIF
"Pantai Luas banget, cukup sepi saat PPKM, bisa sewa Jeep, ATV, dll",POSITIF
"Pantai pasir hitam (seperti umumnya pantai di daerah Bantul). Ada pasar ikan dan kolam renang murah (10 ribu kalo belum naik). Harga seafood relatif sama dengan pantai2 lain di Bantul. Sekitar 100k-150k per kg untuk berbagai jenis ikan dan udang2an. Untuk lobster harganya sekitar 200k-700k per kg, tergantung jumlah lobster dalam 1 kg. Walau udah buka, tapi sekarang masih sepi banget, karena masih pandemi.

Oh ya, kalo kita udah masuk ke Pantai Depok, kita bisa mengunjungi beberapa pantai sekaligus antara Depok dan Parangtritis, tanpa harus bayar retribusi lagi, palingan ya nanti bayar parkir aja. Kita juga bisa ke Gumuk Pasir Parangkusumo via Depok.",POSITIF
"Pantai selatan dengan pemandangan yg indah. Memiliki pasir hitam seperti pantai parangtritis. Banyak nelayan dan pedagang ikan di pinggr pantai. Bisa beli ikan trs dimasakin dengan biaya masak 15k atau langsung dtg ke warung untuk membeli masakan ikan dr warung tsb. Harga ikan sudah murah, jd saya rasa tdk perlu menawar.",POSITIF
Love indonesia,POSITIF
Mahal semua,NEGATIF
"Tempatnya enak, spot2 untuk poto juga bagus, klo malam lebih bagus lagi, jgn sampai waktu musim hujan ya",POSITIF
"Mall nya besar banget.
Komplit banget.
Prokes dijalankan dengan ketat n aman.
Foodcourt nya juga bersih n murah2",POSITIF
Makanan seafood ya termasuk murah disini yaa,POSITIF
"Hewan nya minim dan banyak yang sudah tua"" ?Ù÷?",NEGATIF
Kurangnya orang yang jualan,NEGATIF
"Kebun Binatang Gembira Loka, satu-satunya kebun binatang di Jogja. Tempatnya indah kayak hutan terutama di zona burung yang sangat rindang dan tempatnya bagus sekali. Untuk zona burung pinguin di kebun binatang ini juga ada. Untuk anak-anak yang mau berfoto dengan hewan seperti gajah dan unta. Jika capek bisa naik kereta yang mengelilingi kebun binatang. Paling kasihan hewan yang cuman seekor dikandang tidak ada temen nya. Saran saya tukeran dengan hewan di kebun binatang lain biar bisa berkembang biak yang sendiri itu dan tidak punah. Paling merinding di Zona Ular...",POSITIF
Tempat yang pas klau mau cari seafood yang fresh. Makanannya jga ckp murah,POSITIF
Pantai yang selalu ramai pengunjung ..apalagi minggu pagi ..Dulu pernah beli ikan yang sudah mateng trs dibawa pulang ..pas mau makan di buka bagian tengah ikan banyak belatungnya ..nah kemarin beli udang yang udah mateng juga ada beberapa yang bau ..lebih selektif lur kalo beli seafood yang udah mateng ..,NEGATIF
Makanan murahh,POSITIF
"Destinasi wisata budaya yang dikelola dengan baik, professional sehingga memberikan pengalaman yang jarang ditemukan di lokasi serupa lainnya.",POSITIF
Suka berkunjung,POSITIF
"Datang pas masa pandemi, pengunjung ga terlalu banyak. Kebanyakan keluarga yang ngajak anak"".

Pintu masuk lewat pintu barat, pintu masuk yang lain ditutup. Tempatnya uda banyak yang di perbaharui, bagus buat ngajak anak. Jam buka 10 pagi sampai jam 15 sore.",POSITIF
fasilitas toilet kurang nyaman.. sedikit pilihan menu makanan.,NEGATIF
"pantai yang berada sejajar dengan pantai parangtritis, tapi pintu masuknya sebelum gerbang kawasan parangtritis belok ke kanan. di pantai depok ada tempat pelelangan ikan dan warung-warung yang menawarkan jasa memasak ikan yg sudah kita beli di pasar. pantai depok berpasir hitam dan ombaknya besar, bisa saja bermain air tapi tidak untuk berenang karena berbahaya. ada wahana atv, naik delman dan kuda.",POSITIF
"Seruuu, wahana air bermain anak banyakk, harga tiket jg terjangkau.. mantab, sukses slalu jogja bay",POSITIF
"Ok bgt prioritas pantai setelah Paratriris, pantai Depok lebih ke wisata pantai kuliner seafoodnya,tak ada salahnya bagi anda pecinta seafood fress pantai Depok recomended buat anda.",POSITIF
"Objek wisata yang wajib d kunjungi klu ke jogja, g pernah bosan klu kesini",POSITIF
